,trackid,text,title
245,TRPGMIC128F92F5A2C,mystikal alright alright alright see uhh y'all n't understand huh alright let see uhh make lil clearer y'all n't walk water jump build nothing first get hurt get fuck rapper pay attention put chalkboard start concrete lyrical lawnmower say house build shit bitch fuck dat filt non filt ba'dat-tat-tat boom boom boom louisiana number one zorro two boom get catch roll thru hold back come short gold fall fuck dat tell come back harder mean shit yeah mad couple million dollars last year spend bitch like martin luther king 'll project jealous want kill like white man town get scope n't stand still 'cause put haaa-o hot sauce jaguar top see start mystikal alright alright alright alright alright alright see start big trunk alright alright alright alright alright alright jive record like promote violence diss artists nothin faithful gumbo kill kill game jack knife cutthroat let rip n't hold back shit nigga say feel eva graphic explicit rappin dis bitch kick who-eva complain reason get somethin say late 'cause reason come grow folks n't like doin suck daddy long stroke crunk trunk tight school days gamma phi kappa stumble n't see nigga play disrespect front take head come n't give fuck nigga nigga mystikal alright alright alright alright alright alright see start big trunk alright alright alright alright alright alright jive record think hear talkin shit n't get nothin nigga fuck come nigga fuck talkin 'bout head roll less bread talkin way bitch ass nigga somethin say 'll think 'll know serious real get kickin dis shit guess i'mma show take picture sympathy see face remember mystikal alright alright alright alright alright alright see start big trunk alright alright alright alright alright alright jive record mystikal alright alright alright alright alright alright see start big trunk alright alright alright alright alright alright jive record,Alright
246,TRPGPDK12903CCC651,evanescence bring life see eye like open doors lead core 've become numb without soul spirit sleep somewhere cold find lead back home wake wake inside n't wake wake inside save call name save dark wake bid blood run n't wake come undo save save nothing 've become know without n't leave breathe make real bring life wake wake inside n't wake wake inside save call name save dark wake bid blood run n't wake come undo save save nothing 've become bring life 've live lie nothing inside bring life freeze inside without touch without love darling life among dead time n't believe could n't see keep dark front 've sleep thousand years seem get open eye everything without think without voice without soul n't let die must something bring life wake wake inside n't wake wake inside save call name save dark wake bid blood run n't wake come undo save save nothing 've become bring life 've live lie nothing inside bring life,Bring Me To Life
247,TRPFLRB128F14A895D,arcade fire cars know place plan know place ship hey cars hey cars know know place spaceships know place sub hey cars hey cars know hey kid know hey cars click light start dream click light start dream little baby let women children let old folks let n't know 're,No Cars Go
248,TRPFKZM12903D11317,basic space neck chest waist floor easy take could take fours make deal day piece take stay week 'll take piece take apart 've suffer shipwreck right start 've underwater breathe think lose end begin basic space open air n't look away nothing set stone piece piece alone air tight break keep keep safe pool boil wax get let set get seal n't adjust n't relearn get keep preserve basic space open air n't look away nothing hot wax leave shine would n't know leave behind second skin second skin n't let still let n't let still let,Basic Space
249,TRPFYYL128F92F7144,modest mouse float back car cop car day well drive sometimes life okay run mouth bite much say well laugh okay 'll float okay 'll float okay 'll float okay 'll float anyway well fake jamaican take every last dime scam worth learn sleight-of-hand bad news come n't worry even land good news work way plan get fire exactly day well 'll float good news way 'll float okay 'll float okay 'll float okay 'll float alright already 'll float n't worry 'll float alright already 'll float alright n't worry 'll float alright already 'll float alright already 'll float alright n't worry even things end bite heavy 'll float alright already 'll float alright already 'll float okay n't worry 'll float even things get heavy 'll float alright already 'll float alright n't worry 'll float alright float,Float On
250,TRPAAWS128F92F4130,darius rucker alright alright alright yeah alright alright n't need five star reservations 've get spaghetti cheap bottle wine n't need concert city 've get stereo best patsy cline n't get caviar dom perignon far see 've get everything want 'cause 've get roof head woman love lay bed alright alright 've get shoe feet forever eye star back alright alright yeah 've get need alright maybe later 'll walk river lay blanket stare moon may french riviera long may simple life okay ask baby think 've get make 'cause 've get roof head woman love lay bed alright alright 've get shoe feet forever eye star back alright alright yeah 've get need alright alright yeah yeah lay night thank lord give everything ever could dream 'cause 've get roof head woman love lay bed alright alright alright alright 've get shoe feet forever eye star back alright alright alright yeah 've get need yeah 've get need alright yeah alright,Alright
251,TRPNPTL128EF35F8B6,maroon make wonder wake blood-shot eye struggle memorize way felt thighs pleasure make cry feel good bad worth aftermath try get back still n't reason n't time really make wonder ever give fuck give something believe cause n't believe anymore anymore wonder even make difference try yeah goodbye god damn spin head decisions make bed must lay deal things leave unsay want dive 're get behind make move forget truth still n't reason n't time really make wonder ever give fuck give something believe cause n't believe anymore anymore wonder even make difference even make difference try yeah tell 're feel n't believe true anymore anymore wonder even make difference cry although goodbye 've one day 'll wake n't hurt anymore catch lie alibi word say n't mean cause still n't reason n't time really make wonder ever give fuck goodbye give something believe cause n't believe anymore anymore wonder even make difference even make difference try yeah tell 're feel n't believe true anymore anymore wonder even make difference cry goodbye goodbye yeah goodbye yeah goodbye,Makes Me Wonder
252,TRPPQSM128E079295E,days new stand play life like board game new fun play people time get tire put away one day get place break self-discipline want feel take slow feel yeah stand stand stand stand stand stand stand stand live life like n't know exist care get care fade away one day come life live want self-discipline want feel take slow feel yeah self-discipline feel take slow feel feel feel feel yeah stand stand stand stand stand stand stand stand,Where I Stand
253,TRPELLJ128F9321962,feist 1234 1234 tell love sleepless long nights youth old teenage hop alive door leave nothing want 're change heart know sweetheart bitter heart tell apart cozy cold put horse cart teenage hop tear eye scar one little lie 're change heart know money n't buy back love money n't buy back love 're change heart know 're change heart know teenage boys 're break heart teenage boys 're break heart,1234
254,TRPSLCW128F9301F83,creedence clearwater revival put spell put spell 're mine better stop things 're say watch n't lie yeah n't gon take none fool around n't gon take none put put spell 're mine right,I Put A Spell On You
255,TRPVKTA128F930B7F0,hollywood undead young young heart bear world fall apart strong n't belong bear world fall apart see children rain like parade pain see love see hate see world make see life see sky give see fly yes wave flag hatred 're ones make watch beauty live pass right eye hear hate word word make hurt get sick 're sick never want medication kid reason live march drum damn come watch burn sun numb young heart bear world fall apart strong n't belong bear world fall apart walk among shadow streets field battle take wear mantle raise hand burn candle hear whisper dark rain see spark feel beat hearts fleet hope depart together walk alone 've ever know 've ever really want place call home take innocence hearts make kneel altar tear apart march drum damn come watch burn sun numb young heart bear world fall apart strong n't belong bear world fall apart fight fall till angels save fight fall till angels save fight fall till angels save fight fall till angels save young heart bear world fall apart strong n't belong bear world fall apart young heart bear world fall apart strong n't belong bear world fall apart,Young
256,TRPDJBX128F42ACF9B,soundgarden black hole sun eye indispose disguise one know hide face lie snake sun disgrace boil heat summer stench 'neath black sky look dead call name cream 'll hear scream black hole sun n't come wash away rain black hole sun n't come n't come n't come stutter cold damp steal warm wind tire friend time honest men sometimes far long snake shoe walk sleep youth pray keep heaven send hell away one sing like anymore black hole sun n't come wash away rain black hole sun n't come n't come black hole sun n't come wash away rain black hole sun n't come n't come black hole sun black hole sun n't come black hole sun black hole sun n't come black hole sun black hole sun n't come black hole sun black hole sun hang head drown fear till disappear black hole sun n't come wash away rain black hole sun n't come n't come black hole sun n't come wash away rain black hole sun n't come n't come black hole sun black hole sun n't come black hole sun black hole sun n't come black hole sun black hole sun n't come black hole sun black hole sun n't come black hole sun black hole sun n't come black hole sun black hole sun n't come n't come,Black Hole Sun
257,TRPOTDA128F14683A3,faith last cup sorrow get old everything know never know run finger like sand enjoy like snake two stone itch bone take deep breath swallow sorrow tomorrow raise let propose toast thing hurt last cup sorrow say finish today last cup sorrow think get way n't begin make end know new face might surprise like snake two stone itch bone take deeper breath swallow sorrow tomorrow raise let propose toast thing hurt last cup sorrow say finish today last cup sorrow think get way might surprise might surprise,Last Cup Of Sorrow
258,TRPKWRN128F9326B71,taylor swift cold way come easily take take best start fight 'cause need feel something want 'cause want shame rainy end give perfect day walk away use defend word never say sit think 've never anywhere cold put wall paint shade gray stand love wash away come away great little story mess dreamer nerve adore shame rainy end give perfect day walk away use defend word never say sit thinkin 've never anywhere cold never give damn thing honey cry cry know would n't tell nobody die die die shame rainy end give perfect day every smile fake condescend count scar make sit think 've never anywhere cold,Cold As You
259,TRPKWOJ128F92DFD64,polly paulusma give back keep head around lose keep secrets close hold course tiny vessel steady reach farthest coast roll away far eye see journey long joyful 'cause 've live tomorrow forget live today sweet life borrow get give back day fee beast everything 've get suffer n't puppet master pull towards shore want cut rope roll away far eye see journey long joyful 'cause 've live tomorrow forget live today sweet life borrow get give back day roll away sail fast hard see light shin really need need 've live tomorrow forget live today sweet life borrow get give back day,Give It Back
260,TRPKQEL128E0795771,zero wait line wait line 'till time tick clock everyone stop everyone say different things different things everyone say different things different things believe see n't seem anybody else agree believe see motionless wheel nothing real waste time wait line believe see nine five live lie everyday steal time everyone take everything everything everyone take everything everything believe feel n't seem anybody else agree believe see motionless wheel nothing real waste time wait line believe see 'll shout 'll scream rather see 'll hide away another day believe see motionless wheel nothing real waste time wait line believe see everyone say different things different things everyone say different things different things everyone say different things different things everyone say different things different things everyone take everything everything everyone take everything everything,In The Waiting Line
261,TRPYQRJ128F42B81C1,eddy grant electric avenue boy ... boy ... street violence lot work place hang wash n't blame sun gon rock electric avenue 'll take higher gon rock electric avenue 'll take higher workin hard like soldier n't afford thing deep heart warrior n't get food kid good god gon rock electric avenue 'll take higher gon rock electric avenue 'll take higher gon rock electric avenue 'll take higher gon rock electric avenue 'll take higher blame one country never get one dealin multiplication still n't fee everyone gon rock electric avenue 'll take higher gon rock electric avenue 'll take higher 2nd interlude street street dead time night gon rock electric avenue 'll take higher gon rock electric avenue 'll take higher 3rd interlude street street playground dark side town gon rock electric avenue 'll take higher hey gon rock electric avenue 'll take higher ohh yeah higher rock daytime rock night repeat fade,Electric Avenue
262,TRTWBNZ128F92F3426,vanessa williams color wind think whatever land land earth dead thing claim know every rock tree creature life spirit name think people people people look think like walk footsteps stranger 'll learn things never know never know ever hear wolf cry blue corn moon ask grin bobcat grin sing voice mountain paint color wind paint color wind come run hide pine trail forest come taste sun-sweet berry earth come roll riches around never wonder 're worth rainstorm river brothers heron otter friends connect circle hoop never end ever hear wolf cry blue corn moon let eagle tell sing voice mountain paint color wind paint color wind high sycamore grow cut 'll never know 'll never hear wolf cry blue corn moon whether white copper-skinned need sing voice mountain need paint color wind earth still 'll earth paint color wind,Colors Of The Wind
263,TRTWEJL128E078DCCA,cat stevens wild world 've lose everything say wan start something new breakin heart 're leavin baby grievin wan leave take good care hope lot nice things wear lot nice things turn bad baby baby wild world hard get upon smile baby baby wild world 'll always remember like child girl know 've see lot world break heart two never wan see sad girl n't bad girl wan leave take good care hope make lot nice friends remember lot bad beware baby baby wild world hard get upon smile baby baby wild world 'll always remember like child girl baby love wan leave take good care hope make lot nice friends remember lot bad beware baby baby wild world hard get upon smile baby baby wild world 'll always remember like child girl baby baby wild world hard get upon smile baby baby wild world 'll always remember like child girl,Wild World
264,TRTGTAG128EF353C26,switchblade symphony dollhouse push pull push pull get bad n't breathe n't let n't let crush push crush push need get away listen hurt word rip tear push hide things hold hand take sicken eye seem mesmerize 're melt glow mesmerize alibi 're laugh snow people climb wall break wretched dolls fingernails scratch outside attic 'll hide people climb wall break wretched dolls fingernails scratch outside attic 'll hide n't let,Dollhouse
265,TRTGUWJ128F146EC54,snow patrol hand open hard argue n't stop make sense tongue still misbehave keep dig grave hand open eye open keep hop heart open would sabotage best thing well make easier know exactly want hand open eye open keep hop heart open easy right get hop right wan hear laugh like really mean collapse tire joy easy right get hop right wan hear laugh like really mean collapse tire joy put sufjan stevens 'll play favorite song 'chicago burst life sweet smile remember hand open eye open keep hop heart open easy right get hop right wan hear laugh like really mean collapse tire joy easy right get hop right wan hear laugh like really mean collapse tire joy easy right get hop right wan hear laugh like really mean collapse tire joy easy right get hop right wan hear laugh like really mean collapse tire joy,Hands Open
266,TRTHGPK128F147DF90,coldplay shiver look direction pay attention know n't listen 'cause say see straight n't moment wake moment sleep 'll side try stop 'll wait line see care want change well change good want know 'll always get way want say n't shiver n't shiver 'll sing loud clear 'll always wait know much need never even see final chance get moment wake moment sleep 'll side try stop 'll wait line see care care want change well change good want know 'll always get way want say n't shiver n't shiver 'll sing loud clear 'll always wait yeah 'll always wait yeah 'll always wait yeah 'll always wait always wait see n't see hear loud clear sing loud clear 'll always wait look direction pay attention know much need never even see,Shiver
267,TRTBVXE128F932828E,creedence clearwater revival corner early evenin supper time courthouse 're start unwind four kid corner try bring willy pick tune blow harp corner street willy poorboys playin bring nickel tap feet rooster hit washboard people get smile blinky thump gut bass solo poorboy twang rhythm kalamazoo willy dance double kazoo corner street willy poorboys playin bring nickel tap feet corner street willy poorboys playin bring nickel tap feet n't need penny hang around 've get nickel n't lay money corner happy noise people come around watch magic boy corner street willy poorboys playin bring nickel tap feet corner street willy poorboys playin bring nickel tap feet corner street willy poorboys playin bring nickel tap feet,Down On The Corner
268,TRTFBOK128F92F9B30,barry white way n't change try please never let n't imagine 're familiar n't see anymore would leave time trouble never could come far take good time 'll take bad time 'll take way n't try new fashion n't change color hair always unspoken passion although might seem care n't want clever conversation never want work hard want someone talk want way need know always old someone know take till believe way believe say love forever promise heart could n't love better love way right n't want clever conversation never want work hard want someone talk want way,Just The Way You Are
269,TRTFVVP12903D052D6,two door cinema club know weeks get time realise right eye take want leave start feel like right eye taste sweet begin tell want n't want alone n't want alone n't say know 've know whole time yeah 've know whole time maybe next year 'll time think question address one try stop fire would n't test best could attain try anything get remember know tell want n't want alone n't want alone n't say know 've know whole time yeah 've know whole time tell want n't want alone n't want alone n't say know 've know whole time yeah 've know whole time,What You Know
270,TRTZPKI128F92FDBB7,coldplay life technicolor wild wind blow corner street every night headlights glow cold war come radio hear baby violent world love n't let n't take streetlights glow hear come hear siren sound feet n't touch grind time come a-creeping time load gun every road ray light o-o-o-on time 'll leak lead still beautiful night love n't let n't take streetlights glow hear come like serenade sound feet n't touch grind gravity release n't ever hold feet n't touch grind,Life In Technicolor ii
271,TRTNFLQ128F92FD031,john mayer neon sky blue get dark enough see color city light trail ruby red diamond white hit like sunrise come come like one tonight lose find high peachtree street mix drink techno beat always heavy everything come come like one come one know slip hand always buzz like neon neon neon neon know long long long burn away n't angel know place hold hard take stand would take anyway come like one come slip hand always buzz like neon neon neon neon know long long long burn away away come like one come slip hand always buzz like neon neon neon neon know long long long burn away,Neon
272,TRTNFRQ12903CB6360,vampire weekend horchata december drink horchata look psychotic balaclava winter cold much handle pincher crab pinch sandals whoaaaaa ooooh december drink horchata look glass aranciata lips teeth ask day boot fists pound pavement come feel think forget chair sit sidewalks walk whoaaaaaa ooooh remember drinkin horchata still enjoy foot masada winter cold much handle pincher crab pinch sandals come feel think forget chair sit sidewalks walk ooh lose lookin back n't fight december drinkin horchata look psychotic balaclava winter cold much handle pincher crab pinch sandals years hearts start harden palm firs grow garden fall near rise bed root shoot tool shed lips teeth ask day shout crack pavement come feel think forget chair sit sidewalks walk lose understand n't fight come feel think forget chair sit sidewalks walk come feel think forget chair sit sidewalks walk,Horchata
273,TRTPWWP128F1486DF3,beirut elephant gun young flee town bury dream underground drink die drink tonight far home elephant gun let take one one 'll lay find around let season begin roll right let season begin take big king let season begin roll right let season begin take big king rip silence camp night rip night rip silence camp night rip silence leave hide,Elephant Gun
274,TRTPHMP128F4298D45,decemberadio find wait 've hear angels 've see devil fight lamb send fire 've valley dry walk thru desert side preacher hero life never kind one thing hold lord mine years dry tear answer prayers wan feel presence knees need friend 've find wait 've see widow cry thru sorrow still raise hand midst lord remind weary carry yes carry years dry tear answer prayers wan feel presence knees need friend 've find strong wait midst struggle one thing know 'll never leave 're never alone 've hear angels 've see devil fight lamb strong send straight fire yeah yeah yeah years dry tear answer prayers wan feel presence knees need friend find wait lord find higher wait wait ... find wait ...,Find You Waiting
275,TRTUVGS128F9300770,guru josh project infinity 2008 key philosophy freak like need infinity relax take time take time trust find infinity infinity take time trust find infinity infinity time naturally 'll receive infinity key philosophy freak like need infinity relax take time take time trust find infinity infinity infinity infinity infinity infinity infinity take time trust find time naturally 'll receive infinity infinity,Infinity 2008
276,TRTLNUT12903CF4704,kings check yes juliet check yes juliet rain fall sidewalk n't come outside check yes juliet kill limbo 'll keep toss rock window turn back tonight lace shoe a-o-a-o run baby run n't ever look back 'll tear apart give chance n't sell heart n't say 're mean run baby run forever check yes juliet 'll wait wish want take sneak n't tell soul goodbye check yes juliet countdown 'll fall arm change lock n't let change mind lace shoe a-o-a-o run baby run n't ever look back 'll tear apart give chance n't sell heart n't say 're mean run baby run forever 're fly night 're fly night way high view get better side run baby run n't ever look back 'll tear apart give chance n't sell heart n't say 're mean run baby run forever run baby run n't ever look back 'll tear apart give chance n't sell heart n't say 're mean run baby run forever,Check Yes Juliet
277,TRTEGUJ128F425B7D3,foo fighters pretender keep dark know pretend keep dark begin send skeletons sing bone march need bury deep secrets keep ever ready ready finish make sense plead ignorance whole defense spin infinity wheel spin never end never end old story say like others say another one play 're pretender say never surrender say like others say another one play 're pretender say 'll never ever surrender time tell another soul sale well page print permanent 're temporary temporary old story say like others say another one play 're pretender say 'll never surrender say like others say another one play 're pretender say never surrender voice inside head refuse hear face face mirrorin stare leave right enemy hand 'll take bring knees yeah yeah yeah keep dark know pretend say like others say another one play 're pretender say never surrender say like others say another one play 're pretender say 'll never surrender say 're like others keep dark say another one play know 're pretender pretend say never surrender say like others keep dark say another one play know 're pretender pretend say never surrender yeah yeah,The Pretender
278,TRTSQLA12903D0737C,john waite miss every time think always catch breath still stand 're miles away wonder leave storm rag freeze heart tonight hear name certain circle always make smile spend time think almost drive wild heart break long distance line tonight n't miss since 've away n't miss matter might say message wire send signal tonight n't know desperate 've become look like lose fight world mean though try hard understand heart break long distance line tonight n't miss since 've away n't miss matter friends say message send like telegraph soul n't bridge distance stop heartbreak overload n't miss since 've away n't miss matter friends say n't miss n't miss keep lie storm rag freeze heart tonight n't miss since 've away n't miss matter friends say n't miss n't miss n't miss keep lie n't miss n't miss n't miss n't miss n't miss n't miss n't miss matter friends might say n't miss,Missing You
