,trackid,text,title
386,TRVJAGJ128F930EB37,john mayer slow dance burn room silly little moment storm calm deep die breath love 've work n't seem hold like want feel arm nobody gon come save pull many false alarm 're see 're know 're doom dear 're slow dance burn room one always dream one try draw dare say nothing baby 're light ever saw 'll make sadness 'll bitch try hit hurt leave feel dirty n't understand 're see 're know 're doom dear 're slow dance burn room cry n't cry n't cry n't dear 're slow dance burn room burn room burn room burn room burn room n't think oughta know n't think shoulda learn somehow n't think oughta know n't think shoulda learn somehow n't think oughta know n't think shoulda learn somehow n't think shoulda learn somehow n't think shoulda learn somehow n't think shoulda learn somehow n't think shoulda learn somehow,Slow Dancing In A Burning Room
387,TRVJSER128F92FFB5E,bow wow like n't never nobody show things gon show special way feel hold always together baby tell believe 'cause n't neva nobody like different kinda girls like see n't none like see best best baby still n't impress 'cause n't none like know feel chill see girl get like baby way feel get choice keep real 'cause first get together start hang skeptical first figure kinda guy try dog n't kinda guy try make find turn baby show brothers treat lady let drive ride mercedes n't trippin actin shady 'cause baby know n't never nobody show things gon show special way feel hold always together baby tell believe 'cause n't neva nobody like every time think ride call come 'rround love amaze n't wait 'til see wan wit every time 're road make trip whenever doin show n't forget main chick get game chick one chick one hang n't never nobody show things gon show special way feel hold always together baby tell believe 'cause n't neva nobody like okay hit mall pop tag spend jazzin hit runway new season season n't nothin spoil one care feel like n't enough share share give dis give dat need love need love know get holla need love need love affection 'cause 'll protection kinda hard job perfection tell n't tryna let get wit let know trippin 'cause sometimes get first one holla right show trippin sense tense body loose around i'ma without get get togetha say whateva since meet life seem betta n't never nobody show things gon show special way feel hold always together baby tell believe 'cause n't neva nobody like n't never nobody show things gon show special way feel hold always together baby tell believe 'cause n't neva nobody like,Like You
388,TRVSJOM12903CD2DC1,justin bieber one less lonely girl alright let gon one less lonely girl one less lonely girl one less lonely girl one less lonely girl gon one less lonely girl one less lonely girl one less lonely girl many tell yous start overs shoulder cry many promise honest girl many tear let hit floor many bag pack take back tell many either ors let inside inside world 'll one less lonely girl saw many pretty face saw see come come n't need pretty face like need 're mine world gon one less lonely girl come one less lonely girl come one less lonely girl come one less lonely girl gon one less lonely girl come gon put first come 'll show 're worth gon let inside world gon one less lonely girl christmas n't merry 14th february one 'em spend many dinner date set dinner plat n't even touch food many tear photograph saw tap back tell could n't see open door let inside world 'll one less lonely girl saw many pretty face saw see come come n't need pretty face like need 're mine world gon one less lonely girl come one less lonely girl come one less lonely girl come one less lonely girl gon one less lonely girl come gon put first come 'll show 're worth gon let inside world gon one less lonely girl fix break heart give brand new start make believe yeah wan set one girl free fall free fall free fall fall love heart lock know get key 'll take leave world one less lonely gon one less lonely girl one less lonely girl one less lonely girl one less lonely girl gon one less lonely girl one less lonely girl one less lonely girl come one less lonely girl come one less lonely girl come one less lonely girl gon one less lonely girl come gon put first come 'll show 're worth gon let inside world gon one less lonely girl come one less lonely girl come one less lonely girl come one less lonely girl gon one less lonely girl come gon put first come 'll show 're worth gon let inside world gon one less lonely girl shawty,One Less Lonely Girl
389,TRVVTWQ128E078F1B7,bon jovi life n't song broken-hearted silent prayer faith-departed n't gon face crowd 're gon hear voice shout loud life never n't gon live forever want live alive life heart like open highway like frankie say way want live alive life ones stand grind tommy gina never back tomorrow get harder make mistake luck n't even lucky get make break life never n't gon live forever want live alive life heart like open highway like frankie say way want live alive 'cause life better stand tall 're call n't bend n't break baby n't back life never 'cause n't gon live forever want live alive life heart like open highway like frankie say way want live alive life never n't gon live forever want live alive life heart like open highway like frankie say way want live alive 'cause life,It's My Life
390,TRVXLHU128F93450C9,lady gaga boys boys boys hey sugar baby saw twice pop show taste like glitter mix rock roll like lot lot think 're really hot hot know think 're special dance real crazy glamophonic electronic d-d-disco baby like lot lot want hot hot boys boys boys like boys cars boys boys boys buy drink bar boys boys boys hairspray denim boys boys boys love love ohh oh- uh-ohhhh-oooo-wuh-ohh ohh oh- uh-ohhhh-oooo-wuh-ohh baby bad boy retro sneakers let see killers make bleachers like lot lot think 're really hot hot let party hear buddy n't forget lipstick leave ashtray like lot lot want hot hot boys boys boys like boys cars boys boys boys buy drink bar boys boys boys hairspray denim boys boys boys love love boys boys boys like boys cars boys boys boys buy drink bar boys boys boys hairspray denim boys boys boys love love loose like party let get lose ferrari psychotic dramatic like boys love call legs morning buy egg watch heart 're together boys like love ever ohh oh- uh-ohhhh-oooo-wuh-ohh ohh oh- uh-ohhhh-oooo-wuh-ohh ohh oh- uh-ohhhh-oooo-wuh-ohh ohh oh- uh-ohhhh-oooo-wuh-ohh boys boys boys like boys cars boys boys boys buy drink bar boys boys boys hairspray denim boys boys boys love love boys boys boys like boys cars boys boys boys buy drink bar boys boys boys hairspray denim boys boys boys love love boys boys boys like boys cars boys boys boys buy drink bar boys boys boys hairspray denim boys boys boys love love,Boys Boys Boys
391,TRVKJMI128F1490EBA,saliva doperide come like hatchet rollin mass throwin match atop gasoline package throwin rhyme like rachets playas passion comin disastroous bashin runnin round wrong crowd act like bout bout bow 're one see right leave take ride doperide yeah right leave take ride get pay last days rage teenage come strong hard front page n't state never fade steppin sure 're get waste hangin base time 're waste hear talkin local talkin nation everything everything everything 'll never everything n't wan right leave take ride doperide right leave take ride apologies like born-again authorities gon fumble legs yeah buster people life wan talk show deal m-town rollin mass throwin match throwin match atop gasoline package rollin mass throwin match atop gasoline package right leave take ride doperide yeah right leave take ride apologies like born-again authorities gon fumble legs,Doperide
392,TRVYICQ128F4252493,eric clapton tear heaven would know name saw heaven would saw heaven must strong carry 'cause know n't belong heaven would hold hand saw heaven would help stand saw heaven 'll find way night day 'cause know n't stay heaven time bring time bend knees time break heart beg please beg please beyond door peace sure know 'll tear heaven would know name saw heaven would saw heaven must strong carry 'cause know n't belong heaven 'cause know n't belong heaven,Tears In Heaven
393,TRVYUKA12903CEA428,old crow medicine show wagon wheel head south land pin thumbin way north caroline starin road pray god see headlights make coast seventeen hours pickin bouquet dogwood flower hopin raleigh see baby tonight rock mama like wagon wheel rock mama anyway feel hey mama rock rock mama like wind rain rock mama like south-bound train hey mama rock runnin cold new england bear fiddler old-time stringband baby play fiddler pick guitar north country winter keep gettin lose money playin poker leave n't turnin back livin old life rock mama like wagon wheel rock mama anyway feel hey mama rock rock mama like wind rain rock mama like south-bound train hey mama rock walkin south roanoke catch trucker philly nice long toke head west cumberland gap johnson city tennessee get get move sun hear baby callin name know one die raleigh least die free rock mama like wagon wheel rock mama anyway feel hey mama rock rock mama like wind rain rock mama like south-bound train hey mama rock,Wagon Wheel
394,TRVYJCY128F92DE225,taylor swift hey stephen hey stephen know look deceive know saw light walk would talk n't say half things want girls toss rock window 'll one wait even cold hey stephen boy might believe n't always alone 'cause n't help look like angel n't help wan kiss rain come feel magic 've feel since meet n't help one else mmm n't help hey stephen 've hold back feel 've get things say 've see think never see nobody shine way way walk way talk way say name beautiful wonderful n't ever change hey stephen people always leave think stay 'cause n't help look like angel n't help wan kiss rain come feel magic 've feel since meet n't help one else mmm n't help 're dim street light 're perfect n't tonight wait alone come come pull near shine shine shine hey stephen could give fifty reason one choose girls well 're beautiful would write song n't help look like angel n't help wan kiss rain come feel magic 've feel since meet n't help one else mmm n't help look like angel n't help wan kiss rain come feel magic 've feel since meet n't help one else mmm n't help n't help n't help,Hey Stephen
395,TRDMUWU128E078EDDB,nirvana dumb like pretend sun light day fun think dumb maybe happy think happy think happy think happy heart break glue help inhale mend 'll float around hang cloud 'll come hangover 'll hangover 'll hangover 'll hangover skin sun fall asleep wish away soul cheap lesson learn wish luck soothe burn wake like pretend sun light day fun think dumb maybe happy think happy think happy think happy think dumb think dumb think dumb think dumb think dumb think dumb think dumb think dumb think dumb think dumb think dumb think dumb,Dumb
396,TRDGPQO12903CFDBEC,dierks bentley sideways hey girl name loud n't hear thing sure like style see come rock blue jeans white tank top man look drive wild hey n't play nothing slow keep girls floor get make want come back since sun come back around work week time play gon get little bite sideways n't need fight y'all take redneck stuff outside park lot 're n't come back velvet rope n't get slack man 're bust door hey n't play nothing slow keep girls floor get make 'em wan come back since sun come back around work week time play gon get little bite sideways ... sideways right hey hey n't play nothing slow get make 'em wan get make 'em wan get make 'em wan come back hey n't play nothing slow keep girls floor get make 'em wan come back since sun come back around work week time play gon get little bite sideways ... sideways ... sideways ... sideways hey girl name loud n't hear thing,Sideways
397,TRDGUPO128F9332CF6,justin bieber earth ohhh ohhh never think easy cause 're distant wall close 're wonder one solid answer walk dark see look face tear apart fight fight hurt hurt cry cry cry cry live live learn learn try try try try yeah meet middle way back earth earth earth earth way back earth back earth back earth back earth back earth back earth back earth back earth back earth mommy always somewhere daddy live town tell could ever normal somehow tell best tell tear woo far away need fight fight hurt hurt cry cry cry cry live live learn learn try try try try meet middle way back earth earth earth earth way back earth way back earth back earth back earth back earth back earth back earth back earth back earth back earth fell far away use stand road get heart let start meet middle way back earth earth way back earth never think would easy cause distant wall close 're wonder ...,Down To Earth
398,TRDGUAJ128F92D541D,rammstein rammstein rammstein ein mensch brennt rammstein fleischgeruch liegt der luft rammstein ein kind stirbt rammstein die sonne scheint rammstein ein flammenmeer rammstein blut gerinnt auf dem asphalt rammstein mütter schreien rammstein die sonne scheint rammstein ein massengrab rammstein kein entrinnen rammstein kein vogel singt mehr rammstein die sonne scheint,Rammstein
399,TRDHBPQ128F425EA1E,leona lewis bleed love oooh oooh heeey close love n't need pain twice enough vain time start pass know 're freeze oooh something happen first time heart melt grind find something true everyone look around think crazy oooh heeey n't care say love try pull away n't know truth heart cripple vein keep close cut open keep bleed keep keep bleed love keep bleed keep keep bleed love keep bleed keep keep bleed love cut open oooh ... try hard hear talk loud pierce sound fill ears try fill doubt yet know goal keep fall heeey ... eey nothing greater rush come embrace world loneliness see face yet everyone around think crazy maybe maybe n't care say love try pull away n't know truth heart cripple vein keep close cut open keep bleed keep keep bleed love keep bleed keep keep bleed love keep bleed keep keep bleed love love cut open hmm drain find hard believe 'll wear scar everyone see n't care say love try pull away n't know truth heart cripple vain keep close cut open ... keep bleed keep keep bleed love keep bleed keep keep bleed love keep bleed keep keep bleed love love cut open ... keep bleed keep keep bleed love keep bleed keep keep bleed love keep bleed keep keep bleed love cut open keep bleed keep keep bleed love,Bleeding Love
400,TRDRTNQ128F93313A3,metallica ride lightning guilty charge damn n't right someone else control death air strap electric chair n't happen make god say 'll take life flash eye time die burn brain feel flame wait sign flick switch death begin end sweat chill cold watch death unfold consciousness friend finger grip fear flash eye time die burn brain feel flame someone help please god help 're try take away n't want die solo someone help please god help try take away n't want die time move slow minutes seem like hours final curtain call see get true let waken horrid scream free frighten dream flash eye time die burn brain feel flame,Ride The Lightning
401,TRDFNLR12903CB0FE4,camila alejate aléjate hazlo pronto ante que mienta cielo hace gris camino bajo tormenta aléjate escapa vete debo verte entiende que aunque pida que vayas quiero perderte luz alcanza quieras caminar sobre dolor descalza angel cuida puso boca verdad para mostrarte salida aléjate amor que aún estás tiempo soy quien verdad parezco perdón soy quien crees caí del cielo aún crees amor quieres correr riesgo verás que soy realmente bueno engañar hacer sufrir quien más quiero quien más quiero aléjate pues bien sabes que merezco quisiera arrepentirme ser mismo decirte esto aléjate escapa vete debo verte entiende que aunque pida que vayas quiero perderte luz alcanza quieras caminar sobre dolor descalza angel cuida puso boca verdad para mostrarte salida aléjate amor que aún estás tiempo soy quien verdad parezco perdón soy quien crees caí del cielo aún crees amor quieres correr riesgo verás que soy realmente bueno engañar hacer sufrir hacer llorar quien más quiero aléjate amor que aún estás tiempo soy quien verdad parezco perdón soy quien crees caí del cielo aún crees amor quieres correr riesgo verás que soy realmente bueno engañar hacer sufrir ... quien más quiero quien más quiero,Alejate De Mi
402,TRDQGQY128F92F99EE,roux toy love love like stubborn youth rather deny walk break roof look sky false love affection n't want like attention yes false love affection n't like want attention toy n't another girl meet boy toy n't another girl meet boy love love hide smoky light never find truth boy touch leave mystify wish could believe yes false love affection n't want like attention yes false love affection n't like want attention toy n't another girl meet boy toy n't another girl meet boy toy n't another girl meet boy toy n't another girl meet boy false love affection n't want like attention yes false love affection n't like want attention toy n't another girl meet boy toy n't another girl meet boy toy n't another girl meet boy toy n't another girl meet boy,I'm Not Your Toy
403,TRDNHAW128F429DB9A,killers ballad michael valentine michael play star soul sister n't take ride car late call want baby baby n't shy rock children hold head high night try tell ballad valentine get bad know true catch friend dallas take trip new orleans black-eyed ladies n't say 're sorry finally catch train memphis everybody talk blue suede baby know name say hold tight n't see hurt 've get buzz like marlon brando michael valentine n't unite end north dakota although heart mexico muñequita abre tus ojos new suit black tie hold 're gamble man proper like break right catch eye shut mouth wave goodbye tonight n't gon let rain parade say hold tight n't see hurt 've get buzz like marlon brando straight face misery tonight lie say n't cold 've get buzz like greta garbo walk forward sun 've get coat tail leave ride well know gon tonight,The Ballad of Michael Valentine
404,TRDLDIO128F93115F1,pearl jam black sheet empty canvas untouched sheet clay lay spread body five horizons revolve around soul ... earth sun air taste breathe take turn ooh teach ... everything ooh know give ... wear bitter hand chafe beneath cloud everything picture wash black tattoo everything take walk outside surround kid play feel laughter sear mmm twist thoughts spin around head spin spin quick sun drop away bitter hand cradle break glass ... everything picture wash black tattoo everything love bad turn world black tattoo see 'll yeah know someday 'll beautiful life know 'll star somebody else sky ... n't ... n't mine yeah,Black
405,TRDJWWE128F4255A4D,una confusion llegaste con una esperanza espera tuvo final hablabas cuando amaba burlabas creias que hacia tanta falta tus frases olvidaron hiciste ver que habia algo mas las alas arrebatado puedo volar herido vano huracan que mata despacio desangra tan fuerte que hoy acaba paciencia ante mis ganas vivir rindo este sufrir busques que detesto solo encuentro que fui ... fui solo una confusion que soy gran error olvido viejo amor una confusion que actuaste sin pensar que enamoraria tal vez podrias arruinar vida ... quiero que digas nada quiero que vuelvas hablar arma suicida del alma que destruyes amar huracan que mata despacio desangra tan fuerte que hoy acaba paciencia ante mis ganas vivir rindo este sufrir busques que detesto solo encuentro que fui ... fui solo una confusion que soy gran error olvido viejo amor una confusion que actuaste sin pensar que enamoraria tal vez podrias arruinar vida ... regresame los dias que hiciste una mentira creia pues jamas sere capaz engañar con corazon para despues salir corriendo sin ninguna explicacion que soy gran error olvido viejo amor una confusion que actuaste sin pensar que enamoraria tal vez podrias arruinar vida ...,Una Confusion
406,TRDJIPJ128F9321317,colbie caillat realize take time realize warmth crash take time realize side n't n't tell n't spell never gon simple n't spell realize realize perfect 'll never find another realize realize never wonder miss take time realize side n't n't tell take time realize pass n't tell n't spell never gon simple n't spell realize realize perfect 'll never find another realize realize never wonder miss never n't feel meet half way would meet half way could realize realize perfect 'll never find another realize realize never wonder realize realize realize realize ooh ooh ooh miss miss realize realize realize realize,Realize
407,TRDJDUD128F931B10C,metric gim sympathy get hot get close flame wild open space talk like open book sign get time take picture 'll remember someday chance take 're close something better leave unknown 're close something better leave unknown feel bone gim sympathy rather beatles roll stone seriously 're gon make mistake 're young come baby play something like come sun come baby play something like come sun n't stay unknown stay away hook chance take 're close something better leave unknown 're close something better leave unknown feel bone gim sympathy rather beatles roll stone seriously 're gon make mistake 're young come baby play something like come sun gim sympathy rather beatles roll stone seriously 're gon make mistake 're young come baby play something like come sun come baby play something like come sun come baby play something like come sun,Gimme Sympathy
408,TRDSUJR128F4278EE3,incubus wish dig toe sand ocean look like thousand diamonds strew across blue blanket lean wind pretend weightless moment happy happy wish wish wish wish lay head onto sand sky resemble backlit canopy hole punch count ufos signal lighter moment happy happy wish wish wish wish world rollercoaster strap maybe hold care hand busy air say wish wish wish wish wish wish,Wish You Were Here
409,TRDDZMP128EF35F98E,maroon sunday morning sunday morning rain fall steal cover share skin cloud shroud moments unforgettable twist fit mold things get crazy live life get hard would gladly hit road get know someday would lead back someday would lead back may need darkness see come rest bone drive slow sunday morning never want leave finger trace every outline paint picture hand back forth sway like branch storm change weather still together end may need darkness see come rest bone drive slow sunday morning never want leave ... may know may need darkness see come rest bone drive slow sunday morning drive slow yeah yeah yeah yeah yeah yeah flower hair yeah yeah yeah yeah yeah,Sunday Morning
410,TRDDNML128F1496081,amy winehouse monkey man aye aye aye aye aye aye huggin big monkey man ... never saw hear huggin big monkey man never saw hear huggin big monkey man life life huggin big monkey man life life huggin big monkey man know understand huggin big monkey man know understand huggin big monkey man la-la-la la-la-la huggin big monkey man la-la-la la-la-la huggin big monkey man aye aye aye aye aye aye huggin big monkey man aye aye aye aye aye aye huggin big monkey man never saw hear huggin big monkey man never saw hear huggin big monkey man life life huggin big monkey man life life huggin big monkey man know understand huggin big monkey man know understand huggin big monkey man la-la-la la-la-la huggin big monkey man la-la-la la-la-la huggin big monkey man,Monkey Man
411,TRDKCTS12903CB0D64,steppenwolf bear wild get motor runnin head highway look adventure whatever come way yeah darlin gon make happen take world love embrace fire gun explode space like smoke lightnin heavy metal thunder race wind feel yeah darlin gon make happen take world love embrace fire gun explode space like true nature child bear bear wild climb high never wan die bear wild bear wild get motor runnin head highway look adventure whatever come way yeah darlin gon make happen take world love embrace fire gun explode space like true nature child bear bear wild climb high never wan die bear wild bear wild,Born To Be Wild
412,TRDKDVV128F42733CD,enigma knock forbid doors knock forbid doors eia ergo advocata nostra hurray therefore advocate illos tuos misericordes oculos nos turn merciful eye converte iesum toward benedictum fructum ventris tui jesus bless fruit womb -instrumental- way eternity media vita morte sumus midst life death quem quaerimus adjutorem search helper nisi domine lord sancte deus holy god sancte fortis holy firm sancte misericors salvator holy merciful savior amarae morti tradas nos savior n't hand conscientiously bitter death -instrumental- back rivers belief turn light take breath relax ... turn light relax ... take deep breath relax ... take back rivers belief take back rivers belief friend look inside heart look inside soul promise return lamb open seventh seal silence sky take back rivers belief take back rivers belief friend look inside heart look inside soul waching one day 'll rest peace rivers belief,Knocking On Forbidden Doors
413,TRDYMXJ128F9330298,britney spear everytime notice take hand strangers love strong carry without every time try fly fall without wing feel small guess need baby every time see dream see face haunt guess need baby make-believe way see clear seem move easy every time try fly fall without wing feel small guess need baby every time see dream see face 're haunt guess need baby may make rain please forgive weakness cause pain song sorry night pray soon face fade away every time try fly fall without wing feel small guess need baby every time see dream see face 're haunt guess need baby,Everytime
