,trackid,text,title
109,TRBZGSM128E078EDB4,eminem without obie trice real name gimmicks two trailer park girls round outside round outside round outside two trailer park girls round outside round outside round outside guess back back shady back tell friend guess back guess back guess back guess back guess back guess back guess back 've create monster 'cause nobody want see marshall want shady chop liver well want shady 'll give little bite weed mix hard liquor vodka 'll jump start heart quicker shock get shock hospital doctor co-operating rockin table operate wait long stop debate 'cause back rag ovulate know get job ms. cheney husband heart problem complicate fcc n't let let let see try shut mtv feel empty without come dip bum lips fuck cum lips tits get ready 'cause shit get heavy settle lawsuits fuck debbie look like job everybody follow 'cause need little controversy 'cause feel empty without say look like job everybody follow 'cause need little controversy 'cause feel empty without little hellions kid feelin rebellious embarrass parent still listen elvis start feelin like prisoners helpless 'til someone come along mission yell bitch visionary vision scary could start revolution pollutin airwaves rebel let revel bask fact get everyone kissin ass disaster catastrophe see damn much ass ask well back na-na-na-na-na-na-na-na-na-na fix bend antenna tune gon enter endin skin like splinter center attention back winter interest best thing since wrestle infest kid ears nest test attention please feel tension soon someone mention ten cents two cents free nuisance send send look like job everybody follow 'cause need little controversy 'cause feel empty without say look like job everybody follow 'cause need little controversy 'cause feel empty without a-tisket a-tasket tit tat anybody talkin shit shit chris kirk patrick get ass kick worse little limp bizkit bastards moby get stomp obie thirty-six year old baldheaded fag blow n't know 're old let nobody listen techno let gim signal 'll whole list full new insult dope suspenseful pencil ever since prince turn symbol sometimes shit seem everybody want discuss must mean disgust obscene first king controversy worst thing since elvis presley black music selfishly use get wealthy concept work twenty million white rappers emerge matter many fish sea 'll empty without look like job everybody follow 'cause need little controversy 'cause feel empty without say look like job everybody follow 'cause need little controversy 'cause feel empty without kid,Without Me
110,TRBZZUT128F92DD82D,kelly clarkson life would suck without guess mean 're sorry 're stand door guess mean take back say like much want anyone say never come back 'cause belong together yeah forever unite somehow yeah get piece honestly life would suck without maybe stupid tell goodbye maybe wrong try pick fight know 've get issue 're pretty mess either way 've find nothing without 'cause belong together yeah forever unite somehow yeah get piece honestly life would suck without dysfunctional really n't miss n't let yeah 'cause belong together yeah forever unite somehow yeah get piece honestly life would suck without 'cause belong together yeah forever unite somehow yeah get piece honestly life would suck without,My Life Would Suck Without You
111,TRBIFGK128F92F23A2,killers dustland fairytale dustland fairytale begin another white trash county kiss '61 long brown hair foolish eye look like want kind slick chrome american prince blue jean serenade moon river n't believe saw cinderella party dress look nightgown saw devil wrap hand get ready showdown saw minute turn away get money pawn tonight change come disguise revelation set soul fire say always know come around decades disappear like sink ship persevere god give hope still fear n't know mind poison castle sky sit strand vandalize drawbridge closin saw cinderella party dress look nightgown saw devil wrap hand get ready showdown saw end turn page throw money run away straight valley great divide dream hide wind n't blow good girls die sky n't snow bird n't sing field n't grow bell n't ring bell n't ring good girls die cinderella n't sleep bitter form refuge n't know kingdom siege everybody need still magic midnight sun leave back '61 cadence young man eye dream hide,A Dustland Fairytale
112,TRBIXDZ128F427E461,tear fear everybody want rule world welcome life turn back even sleep find act best behaviour turn back mother nature everybody want rule world design remorse help decide help make freedom pleasure nothing ever last forever everybody want rule world room light n't find hold hand wall come tumble 'll right behind glad 've almost make sad fade everybody want rule world n't stand indecision marry lack vision everybody want rule world say 'll never never never never need one headline believe everybody want rule world freedom pleasure nothing ever last ever everybody want rule world,Everybody Wants To Rule The World
113,TRBASRX12903C9FDA8,nickelback savin prison gate n't open hand knees crawlin reach well terrify four wall iron bar n't hold soul need come please callin scream hurry fallin fallin show like last one stand teach wrong right 'll show say say 'll leave life behind say worth save heaven gate n't open break wing fallin see city wall n't get love ledge eighteenth story scream come please callin need hurry fallin fallin show like last one stand teach wrong right 'll show say say 'll leave life behind say worth save hurry fallin need come please callin scream hurry fallin fallin show like last one stand teach wrong right 'll show say say 'll leave life behind say worth save hurry fallin say say 'll leave life behind say worth save,Savin' Me
114,TRBNZPP128F428E6F9,coldplay 're lose feel alone circumnavigate globe ever hope way seem flow circumnavigate hope seem lose control everyone hurt everyone scar everyone scar eye close head hurt eye feel low everyone scar everyone hurt everyone hope,For You
115,TRBNYBX128F422EC61,plain white hey delilah hey delilah like new york city thousand miles away girl tonight look pretty yes time square n't shine bright swear true hey delilah n't worry distance right get lonely give song another listen close eye listen voice disguise side hey delilah know time get hard believe girl someday 'll pay bill guitar 'll good 'll life know would word good hey delilah 've get much leave say every simple song write would take breath away write even love fall thousand miles seem pretty far 've get plan train cars walk way friends would make fun 'll laugh along know none felt way delilah promise time get world never ever 're blame hey delilah good n't miss two years 'll school 'll make history like 'll know whatever want hey delilah one,Hey There Delilah
116,TRBTNPR12903D13765,adam lambert get boot get right 'mount leather black color liner workin strut know n't matter need world love thin line 'tween dark side light side baby tonight struggle get rumble try find would thing ever need yeah money fame fortune never could compete life would party ecstasy new york get high rock rollin get room trash 'til ten morning girls stripper heel boys roll maseratis need world love thin line wild time flat line baby tonight struggle get rumble tryin find would thing would ever need yeah money fame fortune never could compete life would party ecstasy flash light might feel good 've get stick mind yeah fashion stage might get high n't mean thing tonight would thing ever need money fame fortune never could compete life would party ecstasy would thing ever need yeah money fame fortune never could compete never could compete life would party ecstasy ecstasy,If I Had You
117,TRBVNWT128F93173BA,metric help alive tremble 're gon eat alive stumble 're gon eat alive hear heart beat like hammer beat like hammer help alive heart keep beat like hammer hard soft tough tender come take pulse pace runaway train help alive heart keep beat like hammer beat like hammer beat like hammer beat like hammer 're still alive regret life mine n't get wherever get whatever need blood still flow heart still beat like hammer beat like hammer help alive heart keep beat like hammer hard soft tough tender come take pulse pace runaway train help alive heart keep beat like hammer beat like hammer beat like hammer beat like hammer 're still alive regret life mine n't get wherever get whatever need blood still flow heart still beat like hammer beat like hammer beat like hammer beat like hammer tremble 're gon eat alive stumble 're gon eat alive hear heart beat like hammer beat like hammer beat like hammer beat like hammer help alive heart keep beat like hammer,Help I'm Alive
118,TRBOKUK12903CAE13F,five finger death punch bad company bad company always run destiny rise sun bear shotgun hand behind gun 'll make final stand call bad company n't deny bad bad company till day die day die day die rebel souls deserters 've call choose gun throw away sun towns know name death punch sound claim fame call bad company n't deny bad bad company till day die day die day die day die eye eye tooth tooth blood blood 've get die 've get die solo call bad company n't deny bad bad company till day die bad company n't deny bad bad company till day die day die day die day die day die,Bad Company
119,TRBXGHM128E0791287,wallflowers one headlight long ago n't remember say lose friend say die easy break heart disease listen cemetary tree see sun comin funeral dawn long break arm human law always seem waste always pretty face wonder hang around place hey-ey-ey come try little nothing forever get something better middle cinderella put together could drive home one headlight say cold feel like independance day n't break away parade get openin somewhere front maze ugliness greed 've see sun ahead county line bridge sayin good nothingness head run breath run nothing leave hit end window ledge hey-ey-ey come try little nothing forever get something better middle cinderella put together could drive home one headlight well place old feel like beat truck turn engine engine n't turn well smell cheap wine cigerettes place always mess sometimes think like watch burn alone feel like somebody else man n't change know n't somewhere city wall die dream think death must kill hey hey hey-ey-ey come try little nothing forever get something better middle cinderella put together could drive home one headlight,One Headlight
120,TRBXLFU128F427A494,bon iver creature fear full count lose fool long visit wrong say many foreign worlds relatively fuck ready ready creature fear tease blouse spit mouth loud lower seminary soul tear tail take wind soft bloody nose sign another floor many territories ready reform n't let form n't let form creature fear foil ready reform many torahs many creature fear,Creature Fear
121,TRBXVEA12903CD2DCA,justin bieber stick moment wish another time wish another place romeo juliet bet never felt way felt bonnie clyde never hide like know n't work fun game 'til someone get hurt n't n't let n't wan let n't wan let know might something real two know n't wan fall 're trip hearts reckless clumsy cause know n't love hey wish another time wish another place everything stick moment nothing heart fight time space 'cause still stick moment see like adam eve tragedy destiny like sonny cher n't care 've get baby see fight every inch fiber cause n't way gon end right foolish stop n't wan let n't wan let know might something real two know n't wan fall 're trip hearts reckless clumsy know n't love hey wish another time wish another place everything stick moment nothing heart fight time space cause still stick moment see like cold cruel world say n't baby right disagree n't n't wan old gray reminisce better days convention tell let 'll never know wish another time wish another place cause everything everything stick moment yeah wish another time wish another place everything stick moment nothing heart nothing heart fight time space space still stick moment,Stuck In The Moment
122,TRBXOCM128F92EF9C4,passion pit sleepyhead everything beat everything beat everything instrumental say like fire around brim burn solid burn thin burn rim like star burn hole right dark flick fire like saltwater eye one inch edge bed drag back sleepyhead sleepyhead could n't think something say day burst lions might thirst crowd bedroom like thoughts wear thin wall rule skin beard grow floor doors eye begonia sky like sleepyhead sleepyhead,Sleepyhead
123,TRBKFKL128E078ED76,eminem hailie song n't sing feel like sing wan fuckin sing 'cause happy yeah happy get baby back check somedays sit star window watchin world pass sometimes think nothin live almost break cry sometimes think crazy crazy crazy waste time see baby suddenly crazy make sense look eye sometimes feel like world shoulder everyone lean 'cause sometimes feel like world almost come back baby girl keep gettin older watch grow pride people make joke 'cause n't understand n't see real side act like shit n't faze inside drive crazy insecurities could eat alive see baby suddenly crazy make sense look eye 'cause sometimes feel like world shoulder everyone lean 'cause sometimes feel like world almost come back man could sing keep singin song daughter could hit note blow something long father show feel proud get god daddy glad mom n't want probably get picture public persona pistol packin drug addict bag mama wan take time perfectly honest 'cause lot shit keep bottle hurt deep inside soul know grow colder older grow boulder shoulder get heavy harder hold load like weight world think neck breakin give try live expectations look love daughter life get wife determine make life livin hell handle well give circumstances deal many chance man bad could someone else years 've waste nothing tear 've taste facin three felonies six years probation 've jail woman 've bat woman 've take bat people back bend backwards woman man see come stick penis would n't rip pre-nup i'da see fuckin fuck reason cry get baby baby lady adore hailie sayonara try tommorra nice know baby travel back arm rightful owner suddenly seem like shoulder blades shift like greatest gift get weight lift n't feel like world shoulder everyone lean 'cause baby know dad soldier nothing take tell n't sing well try hailie remember say ever need anything daddy would right guess daddy n't nowhere baby love,Hailie's Song
124,TRBYFON128E0780C8C,coldplay god put smile upon face nobody know 've get say way god give style give grace god put smile upon face draw line 've get say waste time honey honey fall grace god put smile upon face yeah nahh work worse yeah work want work draw line guess good mine ... nobody know n't ever say 're way well god give style give grace put smile upon face yeah nahh work worse yeah work want work draw line guess good mine ... good mine ... good mine ... good mine ... good mine ... good mine ... good mine ... good mine ... nobody know n't ever say 're way well god give style give grace put smile upon face,God Put A Smile Upon Your Face
125,TRBYIUL128F9305E6B,phoenix lasso would long ago 've think loud suddenly n't know n't forever long long time 've lose way try follow ideal sorry call life waste wear real eye n't realize say yes say yes would would lasso could run could run could run would would tie lasso could run could run could run lonely pretty lack diplomacy n't get n't know n't well far-out far-out fall-out 're lonely n't matter 're well 're well would would lasso could run could run could run would would tie lasso could run could run could run wear real eye n't realize say yes say yes tomorrow long long time 've lose way tomorrow long long time 've lose way,Lasso
126,TRFWGOJ128E0780C8B,coldplay place place place line could n't change lose yeah lose lose cross line n't cross lose yeah yeah long must wait yeah long must pay yeah long must wait scar scar tire prepare 'll wait leave 'll wait yeah yeah long must wait yeah long must pay yeah long must wait sing please please please come back sing please come sing come sing please come back sing place place line could n't change lose yeah yeah ...,In My Place
127,TRFWIRB128F42B6554,muse butterfly hurricanes change everything everything number call fight battle begin revenge surely come hard time ahead best 've get best 've get change world use chance hear time time change everything everything number call fight battle begin revenge surely come hard time ahead best 've get best 've get change world use chance hear time time n't let n't let last chance arrive best 've get best 've get change world use chance hear time time,Butterflies and Hurricanes
128,TRFWASP128F426BD5B,nickelback someday hell wind like n't able see sign miss try turn table wish unclench fists unpack suitcase lately much n't think late nothing wrong long know someday someday somehow gon make right right know 're wonder 're one know someday somehow gon make right right know 're wonder well hope since 're anyway could end say things 've always need say could end stay story play like like paperback novel let rewrite end fit instead hollywood horror nothing wrong long know someday someday somehow gon make right right know 're wonder 're one know someday somehow gon make right right know 're wonder 're one know hell wind like n't able see sign miss try turn table story play like like paperback novel let rewrite end fit instead hollywood horror nothing wrong long know someday someday somehow gon make right right know 're wonder 're one know someday somehow gon make right right know 're wonder 're one know know 're wonder 're one know know 're wonder,Someday
129,TRFGWOW12903CF14C3,adam lambert whataya want hey slow whataya want whataya want yeah afraid whataya want whataya want might 've time would give away upon time n't give damn whataya want whataya want n't give work please n't give n't let mess need second breathe keep come around hey whataya want whataya want whataya want yeah yeah plain see plain see baby 're beautiful nothing wrong freak yeah thank love 'cause 're perfectly yeah might 've time would let slip away would n't even try think could save life n't give work please n't give n't let mess need second breathe keep come around hey whataya want whataya want whataya want whataya want whataya want n't give n't let n't let n't give work please n't give n't let mess mess need second breathe keep come around hey whataya want n't give work please n't give n't let mess need second breathe keep come around hey whataya want whataya want whataya want whataya want whataya want whataya want,Whataya Want From Me
130,TRFGAGX12903CC5BE2,young money roger collard green cornbread gut get dat halloween kick trick treat clutch c'mon nigga trickin flow tighter dick butt jus hop plane come back van couv little white tee sum boob bamboo white girls tell hey nicki camp rule get head shampoo asalaam alaikum oink never let boy boink free cuz barbie bitch join wave penny nickel dime coin phrase coud n't beat leer indian style court side wit cavalier vip roseas beer cuz honey gettin money dont care roger dat young black ricos kill note doe jack son bitch tito wan play game dis bingo monopoly pass gon head deep throat chick somes skin color mocha sally sonia put tha pussys totum pole wat stroke strike like bowlin open like yawnin tha mornin sleepin probably coffin hotter end fuckin august awesome repeat grandma uncles mother tygas dad tha fucka fuckas dis tha last supper look hand i'ma bread cuffer dont dare love dare devil dont fear nun mafucka young money roger dat fresh tha jet sharper gillette blunt still wet pass like brett sip side mug call upset smoke quarter call sudden death i'ma beast pet long kneck keith sweat weezy mothafucka capo dis bitch wit money talk convo dis bitch wit mountain high colorado dis bitch wit flow crazy 730 jus 650 bullets chopper take roof laughin bank goof ball kneck like violin world make spin yall tha prey.amen roger dat roger dat roger hear roger rat fuck around neva get roger back,Roger That
131,TRFHGWV128E0792EC8,bryan adams heaven thinkin younger years young wild free nothing take away 've road keep comin back baby 're want 're lyin arm findin hard believe 're heaven love need find heart n't hard see 're heaven life find someone turn world around bring 're feelin nothin change mean lot could say hold 'cause love light way baby 're want 're lyin arm findin hard believe 're heaven love need find heart n't hard see 're heaven 've waitin long somethin arrive love come along dream comin true good time bad 'll standin baby 're want 're lyin arm findin hard believe 're heaven love need find heart n't hard see 're heaven heaven whoa 're want 're need,Heaven
132,TRFZQIW128F93363FC,kaoma lambada chorando foi quem dia fez chorar chorando foi quem dia fez chorar chorando estará lembrar amor que dia não soube cuidar chorando estará lembrar amor que dia não soube cuidar recordação vai estar com ele aonde recordação vai estar pra sempre aonde danca sol mar guardarei olhar amor faz perder encontrar lambando estarei lembrar que este amor por dia instante foi rei recordação vai estar com ele aonde recordação vai estar pra sempre aonde chorando estara lembrar amor que dia não soube cuidar canção riso dor melodia amor momento que fica dançando lambada,Lambada
133,TRFNGJS128F92F9EEE,kelly clarkson already remember things want memories 're haunt always mean say goodbye even fists hold high never would work right yeah never mean die n't want burn n't come hurt n't stop want know n't matter take road someone get want know could n't love better want move already look make harder know 'll find another n't always make wan cry start perfect kiss could feel poison set perfect could n't keep love alive know love love enough let want know n't matter take road someone get want know could n't love better want move already already already n't make feel right know wrong already already move already already already already already already already yeah remember things want memories 're haunt always mean say goodbye want know n't matter take road someone get want know could n't love better want move already already already n't make feel right know wrong already already move already,Already Gone
134,TRFTUIW128E0784B9F,jack johnson bubble toe simple something nobody know eye big bubbly toe feet queen hearts card feet cover tar ball scar common something nobody know beauty follow wherever hill back house would love forever know could remember mmm use good friends would n't give none want get whole lot reason cant think single one justify leave get none think get many problems man get much time waste dream like commercials dream picture perfect dream relate though 're often underestimate simple something nobody know eye big bubbly toe feet queen hearts card feet infest tar ball well eat lunch little girl come sit next never see nobody move way well 'll move like jellyfish rhythm n't mean nothing flow n't stop move like jellyfish rhythm nothing flow n't stop mmmm common something nobody know beauty follow wherever hill back house wood 'll love forever know would listen might realize 're miss 're miss would listen might realize 're miss 're miss simple something nobody know eye big bubbly toe feet queen hearts card feet infest tar ball,Bubble Toes
135,TRFTYOQ12903CA4808,luke bryan someone else call baby saw truck backin drive sit passenger side messin radio sun glass pull cause could n't believe two weeks ago rid old back roads sing songs everybody round towns whisperin tear eye say listenin baby someone else call baby drive crazy bein dark goodbye never easy break hard 're love girl lay heart n't try save someone else call baby want time want space back whatever take never really think ready move along n't leave till hear say 'll either give word girl baby someone else call baby drive crazy bein dark goodbye never easy break hard 're love girl lay heart n't try save someone else call baby goodbye never easy break hard 're love girl lay heart n't try save someone else call baby girl n't try save someone else call baby someone else call baby,Someone Else Calling You Baby
136,TRFUPBA128F934F7E1,lady gaga paper gangsta midnight rush pen hand dinkin lincoln sand-script fan remember begin sometimes felt def jam ones love tell stop like home girl n't catch shit drop superwoman chick know shit n't fly man 'cause accept less someone real fabulous n't want paper gangsta n't sign away life someone whose get flavor n't follow n't want paper gangsta n't sign monkey paper n't funny business interest fakers n't want paper gangsta n't want paper gangsta n't want paper gangsta n't want paper gangsta get something really shiny start want sign range rover heart 've hear yeah dinners nice till diamond word melt ice rap beat song mr. california paper gangsta raw look love empty page full stuff mean nothing 've play 'cause accept less someone real fabulous n't want paper gangsta n't sign away life someone whose get flavor n't follow n't want paper gangsta n't sign monkey paper n't funny business interest fakers n't want paper gangsta n't want paper gangsta n't want paper gangsta n't want paper gangsta n't want paper gangsta n't sign away life someone whose get flavor n't follow n't want paper gangsta n't sign monkey paper n't funny business interest fakers n't want paper gangsta n't want paper gangsta n't want paper gangsta n't want paper gangsta,Paper Gangsta
