,trackid,text,title
0,TRMHHRK128F932A818,nick lowe men liars men men liars word n't worth wear tire hey girls bring rusty pliers pull tooth men liars truth well remember rick astley big fat hit ghastly say never gon give let well tell dick clown though boy make vow bet know men men liars word n't worth wear tire hey girls bring rusty pliers pull tooth men liars truth among god creatures man must slimy slippery stand naked ape monkey suit behind little moustache grow shifty brute one start choke word eat sweat get stories straight men men liars word n't worth wear tire hey girls bring rusty pliers pull tooth men liars truth men men liars word n't worth wear tire hey girls bring rusty pliers pull tooth men liars men liars men liars men liars truth,All Men Are Liars
1,TRMCMYP128F145BC3D,beastie boys maestro cory kiss ass n't interest anyhow interest b-boys fuck man yeah man come block see funk walk 'cause doin like today day yeah get nice get keep movin n't say nothing keep bouncin bumpin struttin one thing ought know well maestro yeah motherfuckers see lookin sayin skinny live phat know 'cause maestro yeah know get feel like rufus thomas crown prince dance mike know romance crazy baldhead part side rid block like water slide 'cause type day feel like press luck 'cause get nothing lose 'cause n't give fuck see player play n't play win play show yeah maestro yeah need everybody cooperation right like find whose favorite detective mannix barnaby jones somebody say columbo yeah micky mahoney clancy claranin barnaby jones say already yeah right 'll know get shit see n't america want america mackin right people oughta call mockin get stoppin man man man maestro three cheer maestro,The Maestro
2,TRMFCNV128F92E8B76,incubus nice know better watch geller bend silver spoon better witness newborn nebulas bloom see high smile surely sing perspective pry weighty eye give wing n't felt way feel today long hard specify begin notice much feel like wake limb pin needle nice know goodbye nice know goodbye nice know goodbye nice know goodbye nice know know deeper deepest cousteau would ever higher heights often think know bless clearly see wood tree obtain bird eye turn blizzard breeze n't felt way feel today long hard specify begin notice much feel like wake limb pin needle nice know goodbye nice know goodbye nice know goodbye nice know goodbye nice know know ... could along n't felt way feel today long hard specify begin notice much feel like wake limb pin needle nice know goodbye nice know goodbye nice know goodbye nice know goodbye nice know know ...,Nice To Know You
3,TRMQIPU128F4289418,foo fighters big talk carry reason know talk aries treasons renew big talk could stand prove get around know true talk carry reason know fell talk carry reason know talk aries treasons renew big talk could stand prove get around know true well talk put never true fell fell fell,Big Me
4,TRMAACY128F92D8195,wolfsheim lifetime get dark soon threaten silence surround wind come islands distance fade stormy grey wash deep ocean stand face wrath others pray calm heart n't beat fast n't afraid lifetime calm heart n't beat fast n't afraid lifetime rain wash away tear wind soothe pain make doubt make fear take wife unborn son tear deep ocean n't pretend love cause nothing leave lose silence come back find feel lonely stand shore destiny find feel lonely life give many dream live n't know 're lose much time beyond wave free others pray calm heart love burn lesson learn sound hear feel n't feel calm heart n't beat fast n't afraid lifetime n't pretend love time scar,Once In A Lifetime
5,TRMNYZQ128F1459E10,shania twain nah ooh yeah oooooh yeah yeah yeah ooh think might begin fillin case n't already know 'll never forget get leave fact downright pretty low n't way wan know n't gon take back n't even try beg plead sweat bleed bad could care cry yeah thats fun ball good last past sure sweet sure sweep feet miss would nah n't find naked cold justa sittin doctor table waitin tell justa longer able feel heart beatin give good reason kinda numb around time tell movin say gon phone long n't nothin wrong line late regret 're one say 're better bein apart hate downer n't bother comin 'round 'cause n't change heart change heart yeah fun ball good last past sure sweet sure sweep feet miss would nah n't find naked cold justa sittin doctor table waitin tell justa longer able feel heart beatin give good reason kinda numb around time tell movin say gon phone long n't nothin wrong line nah nah nah nah nah nah nah nah nah nah nah nah nah nah nah nah nah nah nah nah nah nah nah nah hey yea yea yeah well hope learn lesson 'cause 'll never messin head way never gon work much jerk finally feed yeah fun ball good last past sure sweet sure sweep feet miss would nah n't find naked cold justa sittin doctor table waitin tell just-a longer able feel heart beatin give good reason kinda numb around time tell movin say gon phone long n't nothin wrong line nah nah nah nah nah nah nah nah nah nah nah nah nah nah nah nah nah nah nah nah nah nah nah nah ooioh nah nah,Nah!
6,TRMLBEG128F42BA124,metallica one n't remember anything n't tell true dream deep inside feel scream terrible silence stop war wake see much leave nothing real pain hold breath wish death please god wake back womb much real pump life must feel n't look forward reveal look time 'll live feed tube stick like wartime novelty tie machine make cut life hold breath wish death please god wake world one god help hold breath wish death please god help darkness imprison see absolute horror live die trap body hold cell landmine take sight take speech take hear take arm take legs take soul leave life hell,One
7,TRMEBYQ128F932FEFF,britney spear toxic baby n't see call guy like wear warn dangerous fall escape n't wait need hit baby give 're dangerous love high n't come lose head spinnin 'round 'round feel taste lips ride 're toxic slippin taste poison paradise addict n't know 're toxic love n't know 're toxic get late give take sip devil cup slowly take high n't come air around feel taste lips ride 're toxic slippin taste poison paradise addict n't know 're toxic love n't know 're toxic n't know 're toxic taste lips ride 're toxic slippin taste poison paradise addict n't know 're toxic taste lips ride 're toxic slippin taste poison paradise addict n't know 're toxic intoxicate lovin think ready think ready intoxicate lovin think ready,Toxic
8,TRMEEIY12903CAC43C,two door cinema club undercover martyn speak word would melt hand speak word wisdom basement people basement many surprise await basement people basement hide last time know 're gon find sick cars seat 'cause 're main streets complete mission hide last time know 're gon find sick cars seat 'cause 're main streets complete mission speak word would melt hand speak word wisdom basement people basement many surprise await basement people basement hide last time know 're gon find sick cars seat 'cause 're main streets complete mission hide last time know 're gon find sick cars seat 'cause 're main streets complete mission hide last time know 're gon find sick cars seat 'cause 're main streets complete mission hide last time know 're gon find sick cars seat 'cause 're main streets complete mission,Undercover Martyn
9,TRMJXVS12903CACEDC,leona lewis forgive first time everything definitely one nights know look eye gon trouble never want lie know baby would cry know love n't pass test get get somewhere else well need man hope understand forgive baby get take chance tonight n't wait sit alone man really hope hope forgive hope forgive hope forgive n't wait man really hope hope forgive long time since something good put hell wan finally find somebody else really want make feel things 've miss long love always pass test shame look somewhere else well need man hope understand forgive baby get take chance tonight n't wait sit alone man really hope hope forgive hope forgive hope forgive n't wait man really hope hope forgive forgive need love forgive n't wait around forgive find man understand need forgive need love forgive n't wait around forgive find man understand forgive baby get take chance tonight n't wait sit alone man really hope hope forgive hope forgive hope forgive n't wait man really hope hope forgive get take chance tonight n't wait sit alone man really hope hope forgive,Forgive Me
10,TRMSBLH128F92D262C,rise hero war say son see world well would say say could carry gun 'll even get pay say sound pretty good black leather boot spit-shined bright cut hair look alright march sing become friends learn fight hero war yeah 'll come home 'll damn proud 'll carry flag grave must 'cause flag love flag trust kick door yell command children cry get man take away bag face family friends take clothe piss hand tell stop join beat gun batons hero war yeah 'll come home 'll damn proud 'll carry flag grave must 'cause flag love flag trust walk bullets haze ask stop beg stay press lift gun fire away shell jump smoke sand blood soak collapse flag hand flag white snow hero war see medals scar damn proud bring home flag gather dust flag love flag trust say son see world well would say say could,Hero Of War
11,TRMVWMZ128F92F23AC,killers n't stay emotion electric star align know make decision never make time never make time dark n't stay far n't stay much longer rid decision home exoneration lose eraser forgiver find sun twist days take comfort cause one one dark n't stay far n't stay much longer rid decision home majesty doorstep little boy arm 'll parade around without game plan obligations alarm dark n't stay far n't stay much longer rid decision home dark n't stay far n't stay much longer rid decision home dark,I Can't Stay
12,TRMVRJV128F1488FBC,daft punk something might right time might right one something want say cause something anyway might right one might right time something 've get kind secret share need anything life want anything life 'll miss anyone life love anyone life,Something About Us
13,TRMOYCC128C7196947,doors without hundred days make older since last time saw pretty face thousand lie make colder n't think look miles separate disappear dream face without baby 're still lonely mind think baby dream time without baby 're still dream tonight yeah miles keep rollin people leave way say hello 've hear life overrate hope get better yeah yeah without baby 're still lonely mind think baby dream time without baby 're still dream tonight girl everything know anywhere whoa get hard n't take away love whoa last one fall say get hard wont take away love whoa without baby 're still lonely mind think baby dream time without baby 're still dream tonight girl,Here Without You
14,TRWMFMK128F424EA34,alicia key n't get people live fortune people live fame people live power yeah people live play game people think physical things define within 've know life bore full superficial people want n't want nothing n't baby n't get baby people want diamond ring want everything everything mean nothing n't get yeah people search fountain promise forever young people need three dozen roses way prove love hand world silver platter good would one share one truly care people want n't want nothing n't baby n't get baby people want diamond ring want everything everything mean nothing n't get people want n't want nothing n't baby n't get baby people want diamond ring want everything everything mean nothing n't get yeah n't get baby say nothing whole wide world n't mean thing n't get baby,If I Ain't Got You
15,TRWMZOQ12903CC16CB,jimi hendrix along watchtower must kind way say joker thief much confusion n't get relief businessmen drink wine plowmen dig earth none along line know worth reason get excite thief kindly speak many among feel life joke 've fate let talk falsely hour get late along watchtower princes keep view women come barefoot servants outside cold distance wild cat growl two riders approach wind begin howl along watchtower along watchtower,All Along The Watchtower
16,TRWMAOR128F429831B,justice tthhee ppaarrttyy let tell day pick right clothe hour oooh turn orange karats around neck tonight takin bling dress impress streets taxis showin love 'cause shinin like princess middle thugs club bouncers recognize face waitin line enter place let get party start right let get drink freaky fly right gon stay whole night let get party start right let get drink freaky fly ey-ey-ey-ey-ey-ey-ey-eyyyy callin ladies table throwin back couple bottle tab havin giggle start get crazy table dancin smashin glass start get naughty time show floor play track want girls floor get surround sound wan see fall tryin blast n't takin call let get party start right let get drink freaky fly alright gon stay whole night let get party start right let get drink freaky fly ey-ey-ey-ey-ey-ey-ey-eyyyy know fliest ladies team know make nice fuckin scream gettin ugly club look little trash ballers club know get class bring weirdest cool party get hotel room gettin start better wake fuck cuz sleep uffie hype bitch bangin beat c'mon let take next level let hotel pool finish bottle maybe kiss n't tell rule around must spell lose control 're near let get party start right let get drink freaky fly alright gon stay whole night let get party start right let get drink freaky fly ey-ey-ey-ey-ey-ey-ey-eyyyy,TTHHEE PPAARRTTYY
17,TRWRXSJ128F9314B40,john mayer half heart bear arm imaginary friends free roam make home everywhere 've come crash like realest thing try best understand love bring half heart get grip situation half heart take time half heart get right mind tell n't keep love half heart make believe never love somebody else make plan stay man love lonely song sing 'til day come show another way love bring half heart get grip situation half heart take time half heart get right mind tell n't keep love half heart half heart faith strong fall short long road later hate never give half heart n't stop love n't stop love n't stop love half half heart half heart half heart get real good imagination half heart get half heart get right mind tell half heart n't half heart shotgun wed bride paper ring half heart part man never truly love anything half heart,Half Of My Heart
18,TRWIKPM128F931F1D2,day remember mean lot hey darling hope 're good tonight know n't feel right leave yeah want n't need tell something sweet get 'cause n't come back home till 're sing till everyone sing wait till get home swear make last n't wait till get home swear come tomorrow past well might best hey sweetie well need tonight know n't wan leave yeah want n't help feel complete 're side know n't come home till 're sing till everyone sing wait till get home swear make last n't wait till get home swear come tomorrow past well might best know n't give need even though mean much n't wait everything really happen swear 'll never happy n't dare say friends boy sway know happen eventually everybody sing everybody sing wait till get home everybody sing swear make last everybody sing wait till get home everybody sing swear make last everybody sing,If It Means A Lot To You
19,TRWIKBF128F92DD506,jam blunt goodbye lover disappoint let feel guilty let judge frown 'cause saw end begin yes saw blind know take mine eternal right take soul night may n't stop care touch heart touch soul change life goals love blind know heart blind 've kiss lips hold head share dream share bed know well know smell 've addict goodbye lover goodbye friend one one goodbye lover goodbye friend one one dreamer wake n't break spirit dream take move remember remember use 've see cry 've see smile 've watch sleep father child spend lifetime know fear know mine 've doubt 're fine love swear true live without goodbye lover goodbye friend one one goodbye lover goodbye friend one one still hold hand mine mine asleep bear soul time kneel feet goodbye lover goodbye friend one one goodbye lover goodbye friend one one hollow baby hollow hollow hollow baby hollow hollow,Goodbye My Lover
20,TRWPXOX128F93465C6,muse starlight far away ship take far away far away memories people care live die starlight chase starlight end life n't know worth anymore hold arm want hold arm life electrify life let conspire ignite souls would die feel alive 'll never let promise fade away never fade away hop expectations black hole revelations hop expectations black hole revelations hold arm want hold arm far away ship take far away far away memories people care live die 'll never let promise fade away never fade away hop expectations black hole revelations yeah hop expectations black hole revelations hold arm want hold arm want hold,Starlight
21,TRWSNUJ128F92D3C71,nirvana heart shape box eye like pisces weak 've lock inside heart-shaped box weeks 've draw magnet tar pit trap wish could eat cancer turn black hey wait 've get new complaint forever debt priceless advice hey wait 've get new complaint forever debt priceless advice hey wait 've get new complaint forever debt priceless advice advice meat-eating orchids forgive one yet cut angel hair baby breath break hymen highness leave black throw umbilical noose climb right back hey wait 've get new complaint forever debt priceless advice hey wait 've get new complaint forever debt priceless advice hey wait 've get new complaint forever debt priceless advice advice eye like pisces weak 've lock inside heart-shaped box weeks 've draw magnet tar pit trap wish could eat cancer turn black hey wait 've get new complaint forever debt priceless advice hey wait 've get new complaint forever debt priceless advice hey wait 've get new complaint forever debt priceless advice advice advice advice,Heart Shaped Box
22,TRWSLFM128F429DBA2,killers romeo juliet lovestruck romeo sing streets serenade lay everybody low love song make find streetlight step shade say something like babe juliet say hey romeo nearly give heart attack underneath window sing hey boyfriend back come around sing people like anyway gon juliet dice load start bet explode heart forget forget movie song gon realize time wrong juliet come different streets streets shame dirty mean yes dream dream dream dream real look another one deal fall chain silver fall chain gold fall pretty strangers promise hold promise everything promise thick thin yeah say romeo yeah know use scene juliet make love use cry say love like star love till die place know movie song gon realize time wrong juliet talk like talk love song like way mean everything anything anything except love miss way use keep beat bad company kiss bar rhyme juliet star time juliet make love use cry say love like star love till die place know movie song gon realize time wrong juliet lovestruck romeo sing streets serenade lay everybody low love song make find convenient streetlight step shade say something like babe,Romeo And Juliet
23,TRWVVMX128F1460888,hammer n't touch n't touch n't touch n't touch n't touch music hit hard make say lord thank bless mind rhyme two hype feet feel good know 're superdope homeboy oaktown know beat n't touch tell homeboy n't touch yeah livin know n't touch look eye man n't touch let bust funky lyric n't touch fresh new kick pant get like know wan dance move seat get fly girl catch beat rollin hold pump little bite let know like like cold mission fall back let'em know 're much beat n't touch tell n't touch stand man n't touch sound bell school sucker n't touch give song rhythm make sweat giving'em know talk hammer 're talk 'bout show hype tight singers sweatin pass wipe tape learn gon take burn chart legit either work hard might well quit word know n't touch n't touch break stop hammer time flow say n't groove probably dead wave hand air bust move run finger hair winner dance 're gon get thinner move slide rump minute let bump bump bump bump ... yeah n't touch look man n't touch 'll probably get hype boy 'cause know n't n't touch ring bell school back break stop hammer time n't touch n't touch n't touch break stop hammer time every time see hammer hype dope floor magic mike would ever stop others makin record n't hit tour around world london bay hammer hammer hammer hammer rest play n't touch n't touch n't touch yeah n't touch tell n't touch hype n't touch get outta n't touch,U Can't Touch This
24,TRWDPTD12903D018B5,justin timberlake cry river sun earth n't know ways love take chance make plan bet n't think would come crash n't say already know find chance 'll never n't make sad tell love leave alone tell need call phone girl refuse must confuse guy bridge burn turn cry cry river cry river-er cry river cry river-er yea yea know say somethings better leave unsay n't like talk know n't act like n't know things people tell keep mess head mess head 've pick honesty may blow yea n't say n't say already know find already know chance 'll never chance n't make sad tell love leave alone alone tell need call phone call phone girl refuse must confuse guy like baby bridge burn turn turn cry cry river cry river-er cry river baby cry river-er yea yea damage guess leave damage guess leave damage guess leave damage guess ... leave n't say n't say already know find already know chance 'll never chance n't make sad cry river cry river-er baby cry river cry river-er yea yea cry river baby cry river-er cry river cause 've already cry cry river-er yea yea n't gon cry yea-yea cry river cry river cry river cry river cry river cry cry cry river cry cry cry river cry cry cry river cry cry cry river,Cry Me A River
25,TRWXJOD128F92E58BD,eddie vedder guarantee bend knee way free lift empty cup ask silently destinations accept one breathe circle grow swallow people whole half live say goodnight wive 'll never know get mind full question teacher soul n't come closer 'll like gravity place pull ever someone keep home would everyone come across cage buy think wander never think get indignation pure thoughts alive wind hair feel part everywhere underneath road disappear late night hear tree 're sing dead overhead leave find way consider satellite forever orbit know rule rule know guarantee,Guaranteed
26,TRWKUYR128F42396CB,beirut nantes well long time long time since 've see smile 'll gamble away fright 'll gamble away time year year slip sea well long time long time since 've see smile nobody raise voice another night nantes nobody raise voice another night nantes non t'en prie nous sommes pas chez nous t'assure que n'est pas grave non laisse moi mais qu'est-ce que aujourd'hui j'ai que les hommes dégoûtent vous pensez well long time long time since 've see smile 'll gamble away fright 'll gamble away time year year slip sea well long time long time since 've see smile,Nantes
27,TRWYCBR128F9325C60,explosions sky hand mine instrumental,Your Hand In Mine
28,TRGMZNT128F92DE267,taylor swift tim mcgraw say way blue eye shin put georgia star shame night say lie boy chevy truck tendency gettin stick backroads night right beside summer long time wake find summer think tim mcgraw hope think favorite song one dance night long moon like spotlight lake think happiness hope think little black dress think head chest old fade blue jeans think tim mcgraw hope think september saw month tear thankin god n't see like box beneath bed letter never read three summer back hard find little bittersweet lookin back nice believe think tim mcgraw hope think favorite song one dance night long moon like spotlight lake think happiness hope think little black dress think head chest old fade blue jeans think tim mcgraw hope think back first time since standin street letter leave doorstep first thing 'll read think tim mcgraw hope think favorite song someday 'll turn radio hope take back place think happiness hope think little black dress think head chest old fade blue jeans think tim mcgraw hope think think mmmm ... say way blue eye shine put georgia star shame night say lie,Tim McGraw
29,TRGWVYH12903D019BA,jag panzer reign tyrants neon light flash tyrants raise swords sound metal crash avenue overlords kings black leather word make steel lock doors soon feel knife feel revenge knife 'll get end knife better run life 'cause 're knife bishops street author corruption leaders night wait eruption rider dress black scream fuckin clown bring best fool tear grind hear rumble around blood curdle sound blood stain head body break grind .45 caliber flash life end bang tyrants rule king dead gang reign,Reign Of The Tyrants
